{
  "contract": "PilotAdmissionDecision",
  "contract_version": "0.2.0-draft.1",
  "record_id": "fixture:decision-a",
  "revision": 1,
  "issued_at": "2026-09-23T12:00:00Z",
  "authority_id": "fixture-policy-authority",
  "tenant_id": "fixture-tenant",
  "security_domain_id": "pilot-fixture",
  "correlation_id": "fixture:decision-a",
  "target": {
    "asset_ref": "fixture-device-a",
    "identity_ref": {
      "uri": "urn:kaiba:fixture:identity-a",
      "digest": "sha256:207554e1d17a88f402020c93f89102058dd1330d1f670ea6d50baa7ca1c9c836"
    },
    "storage_ref": {
      "uri": "urn:kaiba:fixture:storage-a",
      "digest": "sha256:0bfd2b35422979160f8695a84f6174f2e7510dbc4f3749e4c5dabab7e70f33f9"
    }
  },
  "adoption_ref": {
    "record_id": "fixture:adoption-a",
    "revision": 1,
    "digest": "sha256:e8ed786947f614faa665783d333e3a1d82c7a8bea45c87be7105adbe9bf7c53f"
  },
  "policy_ref": {
    "record_id": "fixture:pilot-policy",
    "revision": 1,
    "digest": "sha256:7067b03ef57a1dc903b99a4aebf4dfe67743bec70434f767167d63ee144e912e"
  },
  "decision": "approved",
  "accepted_gaps": [
    "FA-01",
    "FA-02",
    "FA-03",
    "FA-04",
    "FA-05",
    "FA-06",
    "FA-07",
    "FA-08"
  ],
  "approver_id": "fixture-approver",
  "review_ref": {
    "uri": "urn:kaiba:fixture:admission-review-a",
    "digest": "sha256:a68be182b7d60f0d0af874a8a46267e172ec3868b5b8950e6218045aa4545e0a"
  },
  "reason": "Synthetic offline conformance approval, never a live grant.",
  "valid_from": "2026-09-23T12:00:00Z",
  "expires_at": "2026-09-23T13:00:00Z",
  "full_qualification": false
}
